Term,Translation,Context,Reference,Comment
web.forms.page.filling.popups.form.validated.go.to.end.button,समाप्त करने के लिए जाओ,This is the button label in the confirmation pop-up when a logged-in user validates their form successfully.,,
web.forms.page.filling.popups.no.cookies,"हमने पाया है कि आपने इस वेबसाइट के लिए ""कुकी"" समर्थन अक्षम कर दिया है। आप ऐसा कर सकते हैं, लेकिन कृपया ध्यान रखें कि, कुकीज़ के बिना, आपकी अनाम पहचान को ट्रैक करने के लिए, आप आंशिक रूप से भरे हुए फॉर्म को फिर से शुरू नहीं कर पाएंगे, आपका सत्र किसी कारण से बाधित होना चाहिए।<br/><br/><b>इसके अलावा, इस सर्वेक्षण को भरने के लिए आप जिस URL का उपयोग कर रहे हैं उसे कॉपी न करें और इसे किसी और के साथ साझा करें। यदि आप करते हैं, तो वे आपके सत्र को देख और फिर से शुरू कर सकते हैं।</b>",The warning message that appears when a user has disabled cookies.,,
web.forms.page.filling.popups.remove.instance.prompt.button,"हां, इसे हटा दें",This is the button label in the confirmation pop-up when you try to remove the current repeat instance.,,
web.forms.page.filling.popups.remove.instance.prompt.message,समूह हटाने की पुष्टि करें,This is the title of the confirmation pop-up when you try to remove the current repeat instance.,,
web.forms.page.filling.popups.remove.instance.prompt.title,"समूह ""{0}"" और उसके सभी उप-समूह निकालें?",This is the message in the confirmation pop-up when you try to remove the current repeat instance. {0} gets replaced by the repeat group label and instance number and must be included in your translation.,,
web.forms.page.filling.popups.resume.prompt.message,"आपने पहले ही इस फ़ॉर्म को भरना शुरू कर दिया है और इसे अंतिम रूप से {0} पर अपडेट किया है। जहाँ से आपने छोड़ा था, उसे फिर से शुरू करें या उस संस्करण को छोड़ दें और फिर से शुरू करें? (यदि आप फिर से शुरू करना चुनते हैं, तो पुराने संस्करण को छोड़ दिया जाएगा और कोई पूर्ववत नहीं है।)",This is the message in the 'resume form' pop-up that is presented when a logged-in user returns after their session expires. {0} gets replaced with the date and time of the last form session and must be included in your translation.,,
web.forms.page.filling.popups.resume.prompt.negative.button,रद्द करें,This is the button label to discard the old form in the 'resume form' pop-up that is presented when a logged-in user returns after their session expires. ,,
web.forms.page.filling.popups.resume.prompt.positive.button,बायोडाटा,This is the button label to resume filling out the old form in the 'resume form' pop-up that is presented when a logged-in user returns after their session expires. ,,
web.forms.page.filling.popups.resume.prompt.title,अन-समाप्त रूप मिला,This is the title of the 'resume form' pop-up that is presented when a logged-in user returns after their session expires. ,,
web.forms.page.filling.popups.resume.different.caseid.message,"आप केस आईडी ""<b>{0}</b>"" के लिए एक नया फ़ॉर्म शुरू करने वाले हैं। हमने देखा कि आपने केस ID ""<b>{1}</b>"" के लिए फॉर्म भरना नहीं छोड़ा है। क्या आप उस फ़ॉर्म को भरना शुरू करना चाहते हैं, या एक नई शुरुआत करना चाहते हैं?","Whenever a user visits a form that they had already started filling out, SurveyCTO attempts to resume the partially-filled form from memory. If the partially-filled form has a dfferent case ID than the current URL, a pop-up will appear with this message asking which form they wish to fill out. {0} will be replaced by the case ID from the current URL, and {1} will be replaced by the case ID from memory. Both {0} and {1} must be included in your translation.",,
web.forms.page.filling.popups.resume.different.caseid.negative.button,{0} फिर से शुरू करें,The button label to continue filling out the partially-filled form from memory. {0} will be replaced by the case ID from memory and must be included in your translation.,,
web.forms.page.filling.popups.resume.different.caseid.positive.button,प्रारंभ {0},The button label to start a brand new form with a new case iD. {0} will be replaced by the case ID from the current URL and must be included in your translation.,,
web.forms.page.filling.popups.resume.different.caseid.title,चेतावनी,The title of the pop-up message prompting which case ID to use.,,
web.forms.page.filling.popups.start.over.prompt.button,परिवर्तनों को निरस्त करें,This is the button label to discard changes in the pop-up when you attempt to start over.,,
web.forms.page.filling.popups.start.over.prompt.message,सभी परिवर्तनों को छोड़ दें और रिक्त फ़ॉर्म के साथ शुरू करें?,This is the message in the pop-up when you attempt to start over.,,
web.forms.page.filling.popups.start.over.prompt.title,बाहर निकलने की पुष्टि करें,This is the title of the pop-up when you attempt to start over.,,
web.forms.page.filling.popups.success.title,सफलता,Generic title of 'success' type pop-ups.,,
web.forms.page.filling.popups.warning.title,चेतावनी,Generic title of 'warning' type pop-ups. ,,
web.forms.page.filling.repeat.table.add.row.button,लाइन जोड़ो,,,
web.forms.page.filling.repeat.table.back.level.button,एक स्तर पर वापस,Tooltip when you hover over the arrow button in the top left of the table summary in a repeat group with the 'table' or 'table-labeled' appearance.,,
web.forms.page.filling.repeat.table.label,सारांश,The heading just above the summary table in a repeat group with the 'table' or 'table-labeled' appearance.,,
web.forms.page.filling.select1.minimal.label,एक उत्तर चुनें,The first option in the dropdown in a select_one field with the 'minimal' appearance.,,
web.forms.page.filling.selectx.minimal.remove.response.button.label,प्रतिक्रिया निकालें,The button label to remove responses in a select_multiple field with the 'minimal' appearance.,,
web.forms.page.filling.text.error.numbers.appearance.invalid.input,"क्षमा करें, आप केवल संख्यात्मक अंक, प्लस -, +, अल्पविराम, बिंदु और स्थान दर्ज कर सकते हैं।","Error message that appears when the user enters one or more invalid characters into a field that uses the ""numbers"" appearance for showing the numeric keypad on mobile devices.",,
web.forms.page.filling.text.error.numbers.phone.appearance.invalid.input,"क्षमा करें, आप केवल फ़ोन अंक, प्लस -, +, बिंदु, हैशटैग, तारांकन और रिक्त स्थान दर्ज कर सकते हैं।","Error message that appears when the user enters one or more invalid characters into a field that uses the ""numbers_phone"" appearance for showing the phone-number keypad on mobile devices.",,
web.forms.page.filling.text.error.url.appearance.blank,कोई url सेट नहीं है।,"Error message that appears when the user clicks to open the URL on a field with the ""url"" appearance but there is no URL to open.",,
web.forms.page.filling.text.intents.error.not.supported,बाहरी रूप वेब प्रपत्रों में समर्थित नहीं हैं। कृपया यहाँ विवरण दर्ज करें।,"Error message that appears when a field with an Android ""intent"" is shown in a web form (because Android intents are not supported in web forms).",,
web.forms.page.filling.text.queries.error.not.supported,वेब प्रपत्रों में क्वेरीज़ समर्थित नहीं हैं। कृपया यहाँ विवरण दर्ज करें।,Error message that appears when a field with a text query is shown in a web form (because text queries are not supported in web forms).,,
web.forms.page.filling.text.url.appearance.button,यूआरएल खोलें,,,
web.forms.page.filling.text.zebra.error.not.supported,वेब रूपों में ज़ेबरा प्रिंटर समर्थित नहीं है।,Error message that appears when a field with a Zebra printer appearance is shown in a web form (because Zebra printers are not supported in web forms).,,
web.forms.page.filling.thankyou.not.submitted.text,धन्यवाद! कोई डेटा जमा नहीं किया गया था।,The message after you 'submit' a form in the test view of the Form Designer but choose to discard the data.,,
web.forms.page.filling.thankyou.not.submitted.title,फॉर्म जमा नहीं किया गया था,The title after you 'submit' a form in the test view of the Form Designer but choose to discard the data.,,
web.forms.page.filling.thankyou.submitted.text,धन्यवाद! आपका फॉर्म सफलतापूर्वक सबमिट कर दिया गया है।,The message after you submit a form.,,
web.forms.page.filling.thankyou.submitted.title,फॉर्म सफलतापूर्वक सबमिट किया गया,The title after you submit a form.,,
web.forms.page.filling.trigger.error.not.supported,वेब फ़ील्ड में ट्रिगर फ़ील्ड समर्थित नहीं हैं। कृपया यहाँ विवरण दर्ज करें।,Error message that appears when a trigger field is shown in a web form (because trigger fields are not supported in web forms).,,
web.forms.page.filling.unknown.field.type.error.not.supported,"फ़ील्ड का प्रकार '{0}' वेब इंटरफेस में प्रदर्शित नहीं किया जा सकता है, इसलिए इसके बजाय एक टेक्स्ट फ़ील्ड का उपयोग किया जाएगा।",Error message that appears when a field with an unknown field type appears in a web form. {0} gets replaced with the field label and must be included in your translation.,,
web.forms.page.filling.video.select.file.button,वीडियो फ़ाइल का चयन करें,The button label in a 'video' field type.,,
web.forms.page.forms.header,भरने के लिए एक रिक्त फ़ॉर्म चुनें:,The heading text at the top of the 'fill blank form' page.,,
web.forms.page.forms.title,खाली फॉर्म भरें,The page title of the 'fill blank form' page.,,
web.forms.page.maim.delete.saved.form.button,सहेजे गए फ़ॉर्म को हटाएं,The button label on the main menu page (only available to logged-in users).,,
web.forms.page.main.download.app.button,ऐप डाउनलोड करें,The button label on the main menu page.,,
web.forms.page.main.edit.saved.form.button,सहेजे गए फॉर्म को संपादित करें,The button label on the main menu page (only available to logged-in users).,,
web.forms.page.main.fill.blank.form.button,खाली फॉर्म भरें,The button label on the main menu page for logged-in users to get to the 'fill blank form' page.,,
web.forms.page.main.manage.cases.button,मामलों को प्रबंधित करें,The button label on the main menu page (only available to logged-in users).,,
web.forms.page.main.sub.title,"सुरक्षित, उच्च गुणवत्ता डेटा संग्रह",The page subheading on the main menu page (only visible to logged-in users).,,
web.forms.page.main.title,मुख्य मेनू,The page title of the main menu page (only visible to logged-in users).,,
web.forms.page.shared.form.delete.button,हटाएं,The button label for deleting a form on the 'delete saved form' page (only available to logged-in users).,,
web.forms.page.shared.form.fill.out,भरना,The button label for filling out a form from any of the main menu sub-pages.,,
web.forms.page.shared.form.last.saved,अंतिम बार बचाया गया,The label preceeding the timestamp on all of the main menu sub-pages (only available to logged-in users).,,
web.forms.page.shared.form.name,नाम,The label preceeding the form name on all of the main menu sub-pages for logged-in users.,,
web.forms.page.shared.form.resume.button,बायोडाटा,The button label for resuming a form from the 'edit saved form' page (only available to logged-in users).,,
web.forms.page.shared.form.id,आईडी,The label preceeding the form ID on all of the main menu sub-pages.,,
web.forms.page.shared.form.title,शीर्षक,,,
web.forms.page.shared.form.version,संस्करण,The label preceeding the form version on all the main menu sub-pages.,,
web.forms.page.shared.no.forms.msg,कोई उदाहरण नहीं हैं।,The message when there are no saved forms on any of the main menu pages (only available to logged-in users).,,
web.forms.page.shared.return.to.main.page.button,मुख्य मेनू पर लौटें,The button label for returning to the main menu when you are on any of the main menu sub-pages.,,