Term,Translation,Context,Reference,Comment
commons.learn.more,और अधिक जानें...,Put anywhere the user can learn more by clicking on a link.,,
commons.powered.by.surveycto,{0} द्वारा संचालित,"SurveyCTO branding. {0} gets replaced by ""SurveyCTO"" and must be included in your translation.",,
web.forms.page.delete.instances.confirmation.message,क्या आप वाकई इस फ़ॉर्म को हटाना चाहते हैं?,"Text to confirm that the user wants to delete a filled-out form (i.e., a submission).",,
web.forms.page.delete.instances.confirmation.negative.button,हटाओ मत,"Button to confirm that the user does NOT want to delete a filled-out form (i.e., to cancel deleting a submission).",,
web.forms.page.delete.instances.confirmation.positive.button,"हाँ, इसे हटा दें","Button to confirm that the user DOES want to delete a filled-out form (i.e., a submission).",,
web.forms.page.delete.instances.confirmation.title,मिटाने की पुष्टि,"Title of the window to confirm that the user wants to delete a filled-out form (i.e., a submission).",,
web.forms.page.delete.instances.header,हटाने के लिए एक फ़ॉर्म चुनें:,Header for list of filled-out forms that can be deleted.,,
web.forms.page.delete.instances.title,सहेजे गए फ़ॉर्म को हटाएं,Title for list of filled-out forms that can be deleted.,,
web.forms.page.edit.instances.header,संपादन फिर से शुरू करने के लिए एक सहेजा गया फॉर्म चुनें:,Header for list of saved forms that can be resumed.,,
web.forms.page.edit.instances.title,सहेजे गए प्रपत्र सूची,Title for list of saved forms that can be resumed.,,
web.forms.page.filling.audio.select.file.button,ऑडियो फ़ाइल का चयन करें,Button for selecting an audio file.,,
web.forms.page.filling.banner.tooltip,{0} (संस्करण: {1}),Information about the current form that appears if the user hovers their mouse over the form title in the upper-left. {0} gets replaced with the current form title. {1} gets replaced with the form version. Both must be included in your translation.,,
web.forms.page.filling.barcode.error.not.supported,वेब फॉर्म में बारकोड स्कैनिंग समर्थित नहीं है। कृपया यहां बारकोड विवरण दर्ज करें।,Error message that appears when showing a barcode field in a web form.,,
web.forms.page.filling.binary.error.large.file,"मुझे क्षमा करें, लेकिन आप एक फ़ाइल संलग्न नहीं कर सकते जो आकार में {0} एमबी से अधिक है। जारी रखने से पहले कृपया एक छोटी फ़ाइल संलग्न करें।",Error message that appears when the user tries to attach a file that is too large. {0} gets replaced with the max file size (in megabytes) and must be included in your translation.,,
web.forms.page.filling.date.months.april,अप्रैल,This is the label used in the month selector in date and datetime fields.,,
web.forms.page.filling.date.months.august,अगस्त,This is the label used in the month selector in date and datetime fields.,,
web.forms.page.filling.date.months.december,दिसंबर,This is the label used in the month selector in date and datetime fields.,,
web.forms.page.filling.date.months.february,फरवरी,This is the label used in the month selector in date and datetime fields.,,
web.forms.page.filling.date.months.january,जनवरी,This is the label used in the month selector in date and datetime fields.,,
web.forms.page.filling.date.months.july,जुलाई,This is the label used in the month selector in date and datetime fields.,,
web.forms.page.filling.date.months.june,जून,This is the label used in the month selector in date and datetime fields.,,
web.forms.page.filling.date.months.march,मार्च,This is the label used in the month selector in date and datetime fields.,,
web.forms.page.filling.date.months.may,मई,This is the label used in the month selector in date and datetime fields.,,
web.forms.page.filling.date.months.november,नवंबर,This is the label used in the month selector in date and datetime fields.,,
web.forms.page.filling.date.months.october,अक्टूबर,This is the label used in the month selector in date and datetime fields.,,
web.forms.page.filling.date.months.september,सितंबर,This is the label used in the month selector in date and datetime fields.,,
web.forms.page.filling.file.current.selection.label,मौजूदा चुनाव,This is the text that appears immediately before the selected file name once you've made a selection in a file field.,,
web.forms.page.filling.file.select.different.button,एक अलग फ़ाइल चुनें,This is the button label once you've made a selection in a file field.,,
web.forms.page.filling.file.select.file.button,किसी फाइल का चयन करें,This is the default button label in a file field before you've made a selection.,,
web.forms.page.filling.geopoint.accuracy,शुद्धता,This is the text that appears immediately before the accuracy value once you've recorded your location in a geo field.,,
web.forms.page.filling.geopoint.altitude,ऊंचाई,This is the text that appears immediately before the altitude value once you've recorded your location in a geo field.,,
web.forms.page.filling.geopoint.error.geolocation.not.supported,जियोलोकेशन इस ब्राउज़र द्वारा समर्थित नहीं है।,Error message that appears when a geopoint field is shown in a browser that does not support location services.,,
web.forms.page.filling.geopoint.error.not.available,स्थान की जानकारी उपलब्ध नहीं है।,Error message that appears when a geopoint field is shown in a browser and location services are not available (possibly because the user has disabled location services or declined to give permission).,,
web.forms.page.filling.geopoint.error.permission.denied,स्थान (अनुमति अस्वीकृत) की पहचान नहीं कर सकता। इस वेबसाइट को आपके स्थान तक पहुँचने की अनुमति देने के लिए आपको अपने ब्राउज़र की सुरक्षा सेटिंग्स को बदलना पड़ सकता है।,Error message that appears when a geopoint field is shown in a browser and location services are not available because of security settings or the user has declined to give permission.,,
web.forms.page.filling.geopoint.error.request.timeout,उपयोगकर्ता स्थान प्राप्त करने का अनुरोध समय समाप्त हो गया।,Error message that appears when a geopoint field is shown in a browser and the system times out before getting a valid location.,,
web.forms.page.filling.geopoint.error.unknown,एक अज्ञात ग़लती हुई।,Error message that appears when a geopoint field is shown in a browser and some unknown error prevents the system from reading the current location.,,
web.forms.page.filling.geopoint.latitude,अक्षांश,This is the text that appears immediately before the latitude value once you've recorded your location in a geo field.,,
web.forms.page.filling.geopoint.longitude,देशान्तर,This is the text that appears immediately before the longitude value once you've recorded your location in a geo field.,,
web.forms.page.filling.geopoint.record.location.button,रिकॉर्ड स्थान,The primary button label in a geo field before you've recorded a location.,,
web.forms.page.filling.geopoint.replace.location.button,स्थान बदलें,This is the button label once you've recorded a location in a geo field.,,
web.forms.page.filling.geoshape.error.not.supported,"यह फ़ील्ड प्रकार वेब इंटरफ़ेस में समर्थित नहीं है, इसलिए आपको इसे ठीक से भरने के लिए Android डिवाइस पर SurveyCTO लीजिए का उपयोग करना होगा। यहां, आप केवल एक ही जीपीएस स्थिति का चयन कर पाएंगे।",Error message that appears when a geoshape field is shown in a web form (because geoshape fields are not supported in web forms).,,
web.forms.page.filling.geotrace.error.not.supported,"यह फ़ील्ड प्रकार वेब इंटरफ़ेस में समर्थित नहीं है, इसलिए आपको इसे ठीक से भरने के लिए Android डिवाइस पर SurveyCTO लीजिए का उपयोग करना होगा। यहां, आप केवल एक ही जीपीएस स्थिति का चयन कर पाएंगे।",Error message that appears when a geotrace field is shown in a web form (because geotrace fields are not supported in web forms).,,
web.forms.page.filling.go.to.button,के लिए जाओ,The label for the 'go to' button.,,
web.forms.page.filling.go.to.UI.close,बंद करे,The label for the red button in the 'go to' screen used to exit the 'go to' screen.,,
web.forms.page.filling.go.to.UI.go.there,वहा जाओ,The label for the button next to each field in the 'go to' screen.,,
web.forms.page.filling.go.to.UI.go.to.end,समाप्त करने के लिए जाओ,The button label in the 'go to' screen for progressing to the end of the form.,,
web.forms.page.filling.go.to.UI.go.to.start,शुरू करने के लिए जाओ,The button label in the 'go to' screen for returning to the beginning of the form. ,,
web.forms.page.filling.go.to.UI.go.up,ऊपर जाना,The button label in the 'go to' UI for when you are currently within an instance of a repeat group and you would like to 'go up' a level.,,
web.forms.page.filling.go.to.UI.resume,बायोडाटा,"When you return to a saved form to continue filling it out, this is the button label in the 'go to' UI for resuming where you left off.",,
web.forms.page.filling.image.align.error.not.supported,संरेखित' उपस्थिति समर्थित नहीं है। कृपया इसके बजाय एक फ़ाइल अपलोड करें।,Error message.,,
web.forms.page.filling.image.annotate.hint,कृपया एक एनोटेट छवि अपलोड करें।,This is the message that appears above the buttons when filling out an image field with the 'annotate' appearance in a web form. ,,
web.forms.page.filling.image.draw.hint,कृपया एक खींची गई छवि अपलोड करें।,This is the message that appears above the buttons when filling out an image field with the 'draw' appearance in a web form. ,,
web.forms.page.filling.image.select.file.button,छवि चुने,Button label in an image field for selecting an existing image. ,,
web.forms.page.filling.image.signature.hint,कृपया अपने हस्ताक्षर के साथ एक फ़ाइल अपलोड करें।,This is the message that appears above the buttons when filling out an image field with the 'signature' appearance in a web form. ,,
web.forms.page.filling.image.take.picture.button,तस्वीर ले लो,Button label in an image field for taking a new picture.,,
web.forms.page.filling.image.web.error.not.supported,वेब' उपस्थिति समर्थित नहीं है। कृपया इसके बजाय एक फ़ाइल अपलोड करें।,This is the message that appears above the buttons when filling out an image field with the 'web' appearance in a web form. ,,
web.forms.page.filling.input.field.placeholder.label,आपका जवाब यहां ...,"This is the placeholder text for the input boxes in text, decimal, and integer fields. ",,
web.forms.page.filling.integer.error.not.integer,कृपया केवल एक पूर्णांक दर्ज करें।,The error message when you try to enter a non-integer into an integer field.,,
web.forms.page.filling.intro.text,"आप एक फॉर्म की शुरुआत में हैं। शुरू करने के लिए तैयार होने पर, कृपया नीचे </ i> अगला </ i> बटन पर क्लिक करें या दाईं ओर। <br/> <br/> अंत में, आपको अपनी प्रतिक्रियाएँ प्रस्तुत करने का अवसर मिलेगा।","Default message that appears at the beginning of a form. The <i>, </i>, and <br/> codes are HTML formatting (the beginning and end of italics and linebreaks, respectively) and should be kept in your translation unless you are comfortable hand-coding HTML.",,
web.forms.page.filling.last.screen.hint,इस फॉर्म को जमा करने के लिए नीचे दिए गए बटन पर क्लिक करें क्योंकि यह वर्तमान में भरा हुआ है।,This is the hint that appears on the last screen of a form for anonymous users (users who are not logged in to your server). It replaces the options to name and finalize the form.,,
web.forms.page.filling.last.screen.mark.finalized.checkbox,अंतिम रूप के रूप में मार्क,The checkbox label when a logged-in user reaches the end of a form.,,
web.forms.page.filling.last.screen.name.label,इस फॉर्म को नाम दें,The input box label when a logged-in user reaches the end of a form.,,
web.forms.page.filling.last.screen.save.exit.button,प्रपत्र सहेजें और बाहर निकलें,The button label for logged-in users when they reach the end of a form. ,,
web.forms.page.filling.last.screen.submit.button,फार्म जमा करें,The button label for anonymous users (users who are not logged in to your server) when they reach the end of a form. ,,
web.forms.page.filling.last.screen.title,आप {0} के अंत में हैं,This is the headline on the last screen of a form. {0} gets replaced with the current form title and must be included in your translation.,,
web.forms.page.filling.login.panel.loggedin.as,आप अभी इस रूप में लॉगिन हैं,"This appears in the user dropdown menu in the top right for logged-in users, and is followed by the user's email address.",,
web.forms.page.filling.login.panel.login.and.continue.btn,लॉग इन करें और जारी रखें,The button label in the user dropdown menu in the top right for anonymous users (users who are not logged in to your server).,,
web.forms.page.filling.login.panel.login.btn,लॉग इन करें,,,
web.forms.page.filling.login.panel.logout.btn,लॉग आउट,The button label in the user dropdown menu in the top right for logged-in users. ,,
web.forms.page.filling.login.panel.not.loggedin.long,आप वर्तमान में लॉग इन नहीं कर रहे हैं,This appears in the user dropdown menu in the top right for anonymous users (users who are not logged in to your server).,,
web.forms.page.filling.login.panel.not.loggedin.short,लोग इन नहीं है,This is the label for the user dropdown menu in the top right for anonymous users (users who are not logged in to your server).,,
web.forms.page.filling.menu.add.comment,टिप्पणी जोड़ें,"If your form contains a comments field, this is the menu option label to leave a comment. ",,
web.forms.page.filling.menu.appearance,दिखावट,This is the dropdown menu label to change the appearance style (only available to logged-in users).,,
web.forms.page.filling.menu.appearance.default,चूक,Label in the Appearance dropdown menu for the 'default' appearance style.,,
web.forms.page.filling.menu.appearance.small,छोटा,Label in the Appearance dropdown menu for the 'small' appearance style.,,
web.forms.page.filling.menu.appearance.small.wide,छोटा चौड़ा,Label in the Appearance dropdown menu for the 'small wide' appearance style.,,
web.forms.page.filling.menu.appearance.wide,चौड़ा,Label in the Appearance dropdown menu for the 'wide' appearance style.,,
web.forms.page.filling.menu.change.language,भाषा बदलो,"If your form contains multiple languages, this option will appear in the 'options' dropdown menu.",,
web.forms.page.filling.menu.clear.responses,स्पष्ट प्रतिक्रियाएँ,The option in the 'options' dropdown menu to remove your response from the current field. ,,
web.forms.page.filling.menu.exit.to.main.menu,मुख्य मेनू से बाहर निकलें,Logged-in users will see this option in the 'options' dropdown menu.,,
web.forms.page.filling.menu.options,विकल्प,The label for the 'options' dropdown menu.,,
web.forms.page.filling.menu.remove.current.repeat.instance,वर्तमान दोहराने उदाहरण निकालें,"In a repeat group, this option will be available in the 'options' dropdown menu.",,
web.forms.page.filling.menu.save.form,प्रपत्र सहेजें,Logged-in users will see this option in the toolbar.,,
web.forms.page.filling.menu.skip.to.next,अगले पर छोड़ें,Logged-in users will see this option in the 'options' dropdown menu.,,
web.forms.page.filling.menu.start.over,प्रारंभ करें,This is the option in the 'options' dropdown menu to discard all the current responses and start over from a blank form.,,
web.forms.page.filling.menu.validate.form,मान्य रूप,Logged-in users will see this option in the 'options' dropdown menu.,,
web.forms.page.filling.nav.end,समाप्त करने के लिए जाओ,The tooltip that appears when you hover over the circle 'go to end' button.,,
web.forms.page.filling.nav.next,आगे,The tooltip that appears when you hover over the circle 'next' button.,,
web.forms.page.filling.nav.previous,पिछला,The tooltip that appears when you hover over the circle  'previous' button.,,
web.forms.page.filling.nav.start,शुरू करने के लिए जाओ,The tooltip that appears when you hover over the circle 'go to start' button. ,,
web.forms.page.filling.next.button,आगे,The button label for the blue 'next' button at the bottom right. ,,
web.forms.page.filling.numerical.error.not.numeric,कृपया केवल एक नंबर दर्ज करें।,Error message that appears when the user is prompted for a decimal value and enters something invalid.,,
web.forms.page.filling.popups.add.comment.intro,कृपया नीचे दिए गए क्षेत्र में अपनी टिप्पणी लिखें:,This is the field label in the pop-up to add a comment.,,
web.forms.page.filling.popups.add.comment.save.button,टिप्पणी सहेजें,This is the button label in the pop-up to save a comment.,,
web.forms.page.filling.popups.add.comment.title,टिप्पणी जोड़ें,This is the title of the pop-up to add a comment.,,
web.forms.page.filling.popups.add.new.group.message,"एक नया ""{0}"" समूह जोड़ें?",{0} gets replaced with the repeat group label and must be included in your translation.,,
web.forms.page.filling.popups.add.new.group.negative.button,ना जोड़े,The button label to not add a new group in the 'add new group' pop-up for repeat groups.,,
web.forms.page.filling.popups.add.new.group.positive.button,समूह जोड़ें,The button label to add a new group in the 'add new group' pop-up for repeat groups.,,
web.forms.page.filling.popups.add.new.group.title,नया समूह जोड़ें?,The title of the 'add new group' pop-up for new repeat groups (when there are no existing instances).,,
web.forms.page.filling.popups.add.one.more.group.message,"एक और ""{0}"" समूह जोड़ें?",This is the message in the pop-up for adding a repeat group when there is already at least one instance. {0} gets replaced with the repeat group label and must be included in your translation.,,
web.forms.page.filling.popups.add.one.more.group.title,एक और समूह जोड़ें?,The title of the 'add new group' pop-up for repeat groups that contain at least one instance already.,,
web.forms.page.filling.popups.cancel.button,रद्द करना,Generic button label for all 'cancel' buttons in pop-ups.,,
web.forms.page.filling.popups.capture.media.done.button,किया हुआ,The button label to save the current snapshot in the 'capture media' pop-up.,,
web.forms.page.filling.popups.capture.media.take.button,स्नैपशॉट लें,The button label to take a picture in the 'capture media' pop-up.,,
web.forms.page.filling.popups.capture.media.title,मीडिया पर कब्जा,The title of the 'capture media' pop-up.,,
web.forms.page.filling.popups.clear.responses.prompt.button,सभी प्रतिक्रियाओं को साफ़ करें,The button label to clear all responses in the confirmation pop-up when you attempt to clear responses. ,,
web.forms.page.filling.popups.clear.responses.prompt.message,इस वर्तमान पृष्ठ पर सभी प्रतिक्रियाएँ साफ़ करें?,The message in the confirmation pop-up when you attempt to clear responses. ,,
web.forms.page.filling.popups.clear.responses.prompt.title,पुष्टि करें,The title of the confirmation pop-up when you attempt to clear responses. ,,
web.forms.page.filling.popups.close.button,बंद करे,Generic button label for all 'close' buttons in pop-ups.,,
web.forms.page.filling.popups.confirm.discard.prompt.button,हाँ मुझे यकीन है!,This is the button label to confirm exiting without saving in the pop-up when logged in users attempt to exit to main menu and then choose to discard changes.,,
web.forms.page.filling.popups.confirm.discard.prompt.message,यह आपके द्वारा दर्ज किए गए किसी भी नए डेटा को छोड़ देगा। क्या आपको यकीन है?,This is the message in the pop-up when logged in users attempt to exit to main menu and then choose to discard changes.,,
web.forms.page.filling.popups.confirm.discard.prompt.title,बाहर निकलने की पुष्टि करें,This is the title of the pop-up when logged in users attempt to exit to main menu and then choose to discard changes.,,
web.forms.page.filling.popups.confirm.title,पुष्टि करें,Generic pop-up title for confirmation pop-ups.,,
web.forms.page.filling.popups.error.title,त्रुटि,Generic title of the pop-up window shown when an error message appears to the user and a more specific window title is not available.,,
web.forms.page.filling.popups.exit.form.prompt.message,"क्या आप बाहर निकलने से पहले अपने फ़ॉर्म को सहेजना चाहते हैं, या आपके द्वारा किए गए सभी परिवर्तनों को छोड़ देना चाहते हैं?",This is the message in the pop-up when logged-in users attempt to exit to main menu.,,
web.forms.page.filling.popups.exit.form.prompt.negative.button,परिवर्तनों को निरस्त करें,This is the button label to discard changes in the pop-up when logged-in users attempt to exit to main menu.,,
web.forms.page.filling.popups.exit.form.prompt.positive.button,परिवर्तनों को सुरक्षित करें,This is the button label to save changes in the pop-up when logged-in users attempt to exit to main menu.,,
web.forms.page.filling.popups.exit.form.prompt.title,बाहर निकलने की पुष्टि करें,This is the title of the pop-up when logged-in users attempt to exit to main menu.,,
web.forms.page.filling.popups.form.saved.confirmation.message,प्रपत्र सफलतापूर्वक सहेजा गया!,This is the message in the confirmation pop-up when a logged-in user saves their form successfully.,,
web.forms.page.filling.popups.form.validated.confirmation.message,मान्यता सफल हुई!,This is the message in the confirmation pop-up when a logged-in user validates their form successfully.,,
