Term,Translation,Context,Reference,Comment,Reference translation
web.forms.page.filling.text.error.url.appearance.blank,,"Error message that appears when the user clicks to open the URL on a field with the ""url"" appearance but there is no URL to open.",,,No url is set.
web.forms.page.filling.text.url.appearance.button,,,,,Open Url
web.forms.page.filling.thankyou.not.submitted.text,,The message after you 'submit' a form in the test view of the Form Designer but choose to discard the data.,,,Thank you! No data was submitted.
web.forms.page.filling.thankyou.not.submitted.title,,The title after you 'submit' a form in the test view of the Form Designer but choose to discard the data.,,,Form was not submitted
web.forms.page.filling.thankyou.submitted.text,,The message after you submit a form.,,,Thank you! Your form has been successfully submitted.
web.forms.page.filling.thankyou.submitted.title,,The title after you submit a form.,,,Form successfully submitted
web.forms.page.filling.unknown.field.type.error.not.supported,,Error message that appears when a field with an unknown field type appears in a web form. {0} gets replaced with the field label and must be included in your translation.,,,"The type of the field '{0}' cannot be displayed in the web interface, so a text field will be used instead."
web.forms.page.filling.video.select.file.button,,The button label in a 'video' field type.,,,Select video file
web.forms.page.forms.header,,The heading text at the top of the 'fill blank form' page.,,,Choose a blank form to fill out:
web.forms.page.forms.title,,The page title of the 'fill blank form' page.,,,Fill blank form
web.forms.page.maim.delete.saved.form.button,,The button label on the main menu page (only available to logged-in users).,,,Delete saved form
web.forms.page.main.download.app.button,,The button label on the main menu page.,,,Download app
web.forms.page.main.edit.saved.form.button,,The button label on the main menu page (only available to logged-in users).,,,Edit saved form
web.forms.page.main.fill.blank.form.button,,The button label on the main menu page for logged-in users to get to the 'fill blank form' page.,,,Fill blank form
web.forms.page.main.manage.cases.button,,The button label on the main menu page (only available to logged-in users).,,,Manage cases
web.forms.page.main.sub.title,,The page subheading on the main menu page (only visible to logged-in users).,,,"Secure, high quality data collection"
web.forms.page.main.title,,The page title of the main menu page (only visible to logged-in users).,,,Main menu
web.forms.page.shared.form.delete.button,,The button label for deleting a form on the 'delete saved form' page (only available to logged-in users).,,,Delete
web.forms.page.shared.form.fill.out,,The button label for filling out a form from any of the main menu sub-pages.,,,Fill out
web.forms.page.shared.form.last.saved,,The label preceding the timestamp on all of the main menu sub-pages (only available to logged-in users).,,,Last saved
web.forms.page.shared.form.name,,The label preceding the form name on all of the main menu sub-pages for logged-in users.,,,Name
web.forms.page.shared.form.resume.button,,The button label for resuming a form from the 'edit saved form' page (only available to logged-in users).,,,Resume
web.forms.page.shared.form.id,,The label preceding the form ID on all of the main menu sub-pages.,,,ID
web.forms.page.shared.form.title,,,,,Title
web.forms.page.shared.form.version,,The label preceding the form version on all the main menu sub-pages.,,,Version
web.forms.page.shared.no.forms.msg,,The message when there are no saved forms on any of the main menu pages (only available to logged-in users).,,,There are no instances.
web.forms.page.shared.return.to.main.page.button,,The button label for returning to the main menu when you are on any of the main menu sub-pages.,,,Return to main menu
