Term,Translation,Context,Reference,Comment,Reference translation
web.forms.page.filling.repeat.table.back.level.button,"Descer um nível","Tooltip when you hover over the arrow button in the top left of the table summary in a repeat group with the 'table' or 'table-labeled' appearance.",,,"Back one level"
web.forms.page.filling.repeat.table.label,Resumo,"The heading just above the summary table in a repeat group with the 'table' or 'table-labeled' appearance.",,,Summary
web.forms.page.filling.select1.minimal.label,"Selecionar uma resposta","The first option in the dropdown in a select_one field with the 'minimal' appearance.",,,"Select one answer"
web.forms.page.filling.selectx.minimal.remove.response.button.label,"Apagar resposta","The button label to remove responses in a select_multiple field with the 'minimal' appearance.",,,"Remove response"
web.forms.page.filling.text.error.numbers.appearance.invalid.input,"Só pode inserir dígitos numéricos, o símbolo de menos (-), mais (+), vírgulas (,), pontos (.) e espaços ( ).","Error message that appears when the user enters one or more invalid characters into a field that uses the ""numbers"" appearance for showing the numeric keypad on mobile devices.",,,"Sorry, you may only enter numeric digits, minus symbols (-), plus symbols (+), commas (,), dots(.), and spaces ( )."
web.forms.page.filling.text.error.numbers.phone.appearance.invalid.input,"Só pode inserir dígitos numéricos, o símbolo de menos (-), mais (+), pontos (.), cardinais (#), asteriscos (*) e espaços ( ).","Error message that appears when the user enters one or more invalid characters into a field that uses the ""numbers_phone"" appearance for showing the phone-number keypad on mobile devices.",,,"Sorry, you may only enter phone digits, minus symbols (-), plus symbols (+), dots (.), hashtags (#), asterisks (*), and spaces( )."
web.forms.page.filling.text.error.url.appearance.blank,"Nenhum url configurado.","Error message that appears when the user clicks to open the URL on a field with the ""url"" appearance but there is no URL to open.",,,"No url is set."
web.forms.page.filling.text.url.appearance.button,"Abrir Url",,,,"Open Url"
web.forms.page.filling.thankyou.not.submitted.text,"Obrigado! Nenhuma informação foi submetida.","The message after you 'submit' a form in the test view of the Form Designer but choose to discard the data.",,,"Thank you! No data was submitted."
web.forms.page.filling.thankyou.not.submitted.title,"O formulário não foi submetido","The title after you 'submit' a form in the test view of the Form Designer but choose to discard the data.",,,"Form was not submitted"
web.forms.page.filling.thankyou.submitted.text,"Obrigado! O seu formulário foi submetido com sucesso.","The message after you submit a form.",,,"Thank you! Your form has been successfully submitted."
web.forms.page.filling.thankyou.submitted.title,"Formulário submetido com sucesso","The title after you submit a form.",,,"Form successfully submitted"
web.forms.page.filling.unknown.field.type.error.not.supported,"Não é possível apresentar o tipo do campo '{0}' na <i>web interface</i>. Este será substituído por um campo de texto.","Error message that appears when a field with an unknown field type appears in a web form. {0} gets replaced with the field label and must be included in your translation.",,,"The type of the field '{0}' cannot be displayed in the web interface, so a text field will be used instead."
web.forms.page.filling.video.select.file.button,"Selecione um ficheiro de video","The button label in a 'video' field type.",,,"Select video file"
web.forms.page.forms.header,"Escolha um formulário em branco para preencher:","The heading text at the top of the 'fill blank form' page.",,,"Choose a blank form to fill out:"
web.forms.page.forms.title,"Preencher formulário em branco","The page title of the 'fill blank form' page.",,,"Fill blank form"
web.forms.page.main.download.app.button,"Download da aplicação","The button label on the main menu page.",,,"Download app"
web.forms.page.main.edit.saved.form.button,"Editar formulário guardado","The button label on the main menu page (only available to logged-in users).",,,"Edit saved form"
web.forms.page.main.fill.blank.form.button,"Preencher formulário em branco","The button label on the main menu page for logged-in users to get to the 'fill blank form' page.",,,"Fill blank form"
web.forms.page.main.manage.cases.button,"Gerir casos","The button label on the main menu page (only available to logged-in users).",,,"Manage cases"
web.forms.page.main.sub.title,"Recolha de dados com segurança e qualidade","The page subheading on the main menu page (only visible to logged-in users).",,,"Secure, high quality data collection"
web.forms.page.main.title,"Menú principal","The page title of the main menu page (only visible to logged-in users).",,,"Main menu"
web.forms.page.shared.form.delete.button,Eliminar,"The button label for deleting a form on the 'delete saved form' page (only available to logged-in users).",,,Delete
web.forms.page.shared.form.fill.out,Preencher,"The button label for filling out a form from any of the main menu sub-pages.",,,"Fill out"
web.forms.page.shared.form.resume.button,Retomar,"The button label for resuming a form from the 'edit saved form' page (only available to logged-in users).",,,Resume
web.forms.page.shared.form.title,Título,,,,Title
web.forms.page.shared.no.forms.msg,"Não há formulários.","The message when there are no saved forms on any of the main menu pages (only available to logged-in users).",,,"There are no instances."
web.forms.page.shared.return.to.main.page.button,"Voltar para o menú principal","The button label for returning to the main menu when you are on any of the main menu sub-pages.",,,"Return to main menu"
web.forms.page.filling.date.months.april,Abril,"This is the month label used in date and datetime fields with the 'no-calendar' appearance.",,,April
web.forms.page.filling.date.months.august,Agosto,"This is the month label used in date and datetime fields with the 'no-calendar' appearance.",,,August
web.forms.page.filling.date.months.december,Dezembro,"This is the month label used in date and datetime fields with the 'no-calendar' appearance.",,,December
web.forms.page.filling.date.months.february,Fevereiro,"This is the month label used in date and datetime fields with the 'no-calendar' appearance.",,,February
web.forms.page.filling.date.months.january,Janeiro,"This is the month label used in date and datetime fields with the 'no-calendar' appearance.",,,January
web.forms.page.filling.date.months.july,Julho,"This is the month label used in date and datetime fields with the 'no-calendar' appearance.",,,July
web.forms.page.filling.date.months.june,Junho,"This is the month label used in date and datetime fields with the 'no-calendar' appearance.",,,June
web.forms.page.filling.date.months.march,Março,"This is the month label used in date and datetime fields with the 'no-calendar' appearance.",,,March
web.forms.page.filling.date.months.may,Maio,"This is the month label used in date and datetime fields with the 'no-calendar' appearance.",,,May
web.forms.page.filling.date.months.november,Novembro,"This is the month label used in date and datetime fields with the 'no-calendar' appearance.",,,November
web.forms.page.filling.date.months.october,Outubro,"This is the month label used in date and datetime fields with the 'no-calendar' appearance.",,,October
web.forms.page.filling.date.months.september,Setembro,"This is the month label used in date and datetime fields with the 'no-calendar' appearance.",,,September
web.forms.page.filling.error.not.supported.web,"Desculpe, ocorreu um erro ao exibir este campo. A seguinte funcionalidade não é compatível com formulários da web: {0}. O campo atual pode estar a utilizar um aspecto alternativo para permitir que você continue a preencher este formulário. Para obter melhores resultados, use o SurveyCTO Collect num dispositivo Android .","This is the error message that is displayed when the current field contains a feature that is unsupported in web forms, but may be supported in Collect for Android or Collect for iOS. {0} will be replaced with the specific feature name that is unsupported, and must be included in your translation.",,,"Sorry, there was an error displaying this field. The following feature is not supported in web forms: {0}. The current field may be using a fallback appearance to allow you to continue filling out this form. For best results, use SurveyCTO Collect on an Android device to fill this form out."
web.forms.page.filling.popups.resume.different.caseid.message,"Está prestes a começar um novo formulário para o caso com ID ""{0}"". Reparámos que o preenchimento do formulário não foi finalizado para o caso com ID ""{1}"". Quer retomar o preenchimento desse formulário, ou começar um novo?","Whenever a user visits a form that they had already started filling out, SurveyCTO attempts to resume the partially-filled form from memory. If the partially-filled form has a different case ID than the current URL, a pop-up will appear with this message asking which form they wish to fill out. {0} will be replaced by the case ID from the current URL, and {1} will be replaced by the case ID from memory. Both {0} and {1} must be included in your translation.",,,"You are about to start a new form for case ID ""{0}"". We noticed that you haven't finished filling out the form for case ID ""{1}"". Do you want to resume filling out that form, or start a new one?"
web.forms.page.shared.form.last.saved,"Guardado pela última vez em","The label preceding the timestamp on all of the main menu sub-pages (only available to logged-in users).",,,"Last saved"
web.forms.page.shared.form.name,Nome,"The label preceding the form name on all of the main menu sub-pages for logged-in users.",,,Name
web.forms.page.shared.form.id,ID,"The label preceding the form ID on all of the main menu sub-pages.",,,ID
web.forms.page.shared.form.version,Versão,"The label preceding the form version on all the main menu sub-pages.",,,Version
web.forms.page.main.delete.saved.form.button,"Apagar formulário guardado","The button label on the main menu page (only available to logged-in users).",,,"Delete saved form"
web.forms.page.login.fill.web.data.collection.disabled.text,"(A recolha de dados pela web não foi ativada para este servidor. Terá de utilizar a aplicação para recolher dados.)","Warning that appears when you access the login page but an admin has disabled web data collection.",,,"(Web data collection has not been enabled for this server, so you must use the mobile app to collect data.)"
web.forms.page.login.go.back.to.console.link,"Clique aqui para iniciar sessão no servidor.","Link for returning to the server console.",,,"Click here to login to the server console."
web.forms.page.login.fill.web.forms.anonymously.button,"Preencher anonimamente formulário online","The button label for filling web forms anonymously.",,,"Fill web forms anonymously"
web.forms.page.login.or.text,Ou,"This text separates the different form access options on the login page (fill forms anonymously, log in, or download the mobile app). Please note: this text will always be rendered in uppercase letters. ",,,Or
web.forms.page.login.servername.input,"Nome do servidor:","The label for the server name input on the login page.",,,"Server name:"
web.forms.page.login.username.input,"Email ou username:","The label for the username input on the login page.",,,"Email address or username:"
web.forms.page.login.username.placeholder,"Email ou username","This is the placeholder for the username input on the login page.",,,"Your email or username"
web.forms.page.login.password.input,Password:,"The label for the password input on the login page.",,,Password:
web.forms.page.login.password.placeholder,Password,"This is the placeholder for the password input on the login page.",,,"Your password"
web.forms.page.login.back.button,Anterior,"The button label for changing the username for login. Appears when external authentication (SSO) is set up on the server, but the current username specified requires a password.",,,Back
web.forms.page.login.next.button,Seguinte,"The button label for proceeding with the login. Appears when external authentication (SSO) is set up on the server, but the current username specified requires a password.",,,Next
web.forms.page.login.login.button,"Iniciar sessão","The button label for logging in.",,,"Log in"
web.forms.page.login.terms.conditions.link,"Termos e condições","The label for the terms and conditions link.",,,"Terms and conditions"
web.forms.page.login.brought.to.you.by.text,"Desenvolvido por","Dobility branding. Appears only on the login page.",,,"Brought to you by"
web.forms.page.login.no.cookies.error,"As ""cookies"" estão desativadas nas configurações de privacidade do seu browser e o SurveyCTO requer cookies para funcionar. Por este motivo, só será possível iniciar sessão depois de activar as cookies e atualizar esta página.","Error message that appears when you try to log in with cookies disabled.",,,"It looks like you have disabled ""cookie"" support in your Internet browser's privacy settings, but SurveyCTO requires cookies to function. Therefore, you are unlikely to be able to login until you enable cookies and refresh this page."
web.forms.page.login.authentication.options.error,"Pedimos desculpa mas não conseguimos identificar as opções de autenticação para '{0}'.","Error message that appears when the server cannot identify authentication options for a username. {0} gets replaced with the attempted username and must be included in your translation.",,,"I'm sorry but we couldn't identify authentication options for '{0}'."